data,sport,mecz,rynek,pewnosc,stawka,kurs,wynik,analiza
2026-07-19,Pilka,FC Anyang – Gwangju FC,Zwycięzca meczu: Gospodarze,Pewny,150.0,1.61,OPEN,"Gwangju jest najsłabszą drużyną ligi z bilansem tylko 1 zwycięstwa w 17 meczach i 11 porażkami, tracąc aż 23 gole na wyjazdach. Anyang, mimo słabego bilansu domowego (1 zwycięstwo w 8 meczach u siebie), jest wyraźnym faworytem i wcześniej w tym sezonie rozgromił Gwangju 5-2. Rynek zakładów Polymarket oraz bukmacherski konsensus jednoznacznie wskazują Anyang jako pretendenta do zwycięstwa"
2026-07-19,Pilka,Halmstad vs Häcken,Zwycięzca meczu: Häcken,Średni,100.0,1.55,OPEN,.
2026-07-19,Pilka,Jaro v Inter Turku,Zwycięzca meczu: Inter Turku,Pewny,150.0,1.57,OPEN,.
2026-07-19,Pilka,Blooming v Real Tomayapo,Zwycięzca meczu: Blooming,Pewny,150.0,1.44,OPEN,.
2026-07-19,Pilka,Atletico Tubarao v Hercilio Luz,Podwójna szansa: X2,Pewny,150.0,1.22,OPEN,.
2026-07-18,Pilka,France v England,Gole — suma meczu: Under 3.5 goli,Średni,100.0,1.7,PRZEGRANA,"Third-place games can be emotional, but the line of over 3.5 goals looks high here. Both teams are coming off painful semi-final defeats, the managers are expected to rotate, and France will be without William Saliba; multiple changes can reduce rhythm and cohesion."
2026-07-19,Pilka,Guarani SC v Blumenau,Zwycięzca meczu: Blumenau,Średni,100.00,1.75,OPEN,.
